{
  "id": "ragu",
  "lineage_id": "8e2b1d1f-3b3f-4a3d-bc67-7b8f4a1a8c2a",
  "name": "Ragu (Basic)",
  "iteration": 1,
  "version": "1.0.0",
  "authors": [
    "swe_bytes"
  ],
  "tags": [
    "italian",
    "sauce"
  ],
  "yield": {
    "amount": 1500,
    "unit": "g"
  },
  "ingredients": [
    {
      "id": "olive_oil",
      "name": "Olive oil",
      "quantity": 30,
      "unit": "g"
    },
    {
      "id": "onion",
      "name": "Yellow onion, finely diced",
      "quantity": 200,
      "unit": "g"
    },
    {
      "id": "carrot",
      "name": "Carrot, finely diced",
      "quantity": 100,
      "unit": "g"
    },
    {
      "id": "celery",
      "name": "Celery, finely diced",
      "quantity": 100,
      "unit": "g"
    },
    {
      "id": "ground_beef",
      "name": "Ground beef",
      "quantity": 500,
      "unit": "g"
    },
    {
      "id": "tomato",
      "name": "Crushed tomatoes",
      "quantity": 700,
      "unit": "g"
    },
    {
      "id": "salt",
      "name": "Salt",
      "quantity": 10,
      "unit": "g"
    },
    {
      "id": "pepper",
      "name": "Black pepper",
      "quantity": 2,
      "unit": "g"
    }
  ],
  "steps": [
    {
      "id": "soffritto",
      "text": "Sweat onion, carrot, celery in olive oil until soft (10 min)",
      "time": {
        "amount": 10,
        "unit": "min"
      },
      "tools": [
        "saucepan"
      ],
      "depends_on": []
    },
    {
      "id": "brown",
      "text": "Add ground beef, brown thoroughly.",
      "tools": [
        "saucepan"
      ],
      "depends_on": [
        "soffritto"
      ]
    },
    {
      "id": "simmer",
      "text": "Add tomatoes, salt, pepper; simmer gently.",
      "time": {
        "amount": 60,
        "unit": "min"
      },
      "depends_on": [
        "brown"
      ]
    }
  ]
}
